{
  "schema": "quest-termux-lab.fleet-agent-heartbeat.v1",
  "fleet_id": "synthetic-lab-fleet",
  "agent_id": "quest-agent-gamma",
  "sequence": 5,
  "observed_at": "2026-06-04T09:01:26Z",
  "agent_uptime_seconds": 64.0,
  "central_reachable": false,
  "battery_percent": 69,
  "charging": false,
  "storage_free_bytes": 3234567890,
  "process_count": 19,
  "active_jobs": 1,
  "last_command_id": "cmd-gamma-status-001",
  "last_command_status": "deferred",
  "last_error_code": null,
  "local_adb": {
    "checked": true,
    "available": false,
    "adb_target": "127.0.0.1:5555",
    "shell_uid": null,
    "last_success_at": null,
    "last_failure_reason": "not_checked_in_synthetic_fixture"
  },
  "foreground": {
    "source": "agent_report",
    "package_or_panel": null,
    "confidence": "low"
  }
}
